{
  "id": "01KS4DG6DQSGPA6431ECBMJX2K",
  "canonical_name": "Malaysian Anti-Corruption Commission (institutional)",
  "institution_category": "anti-corruption",
  "established": "2009-01-01",
  "statutory_basis": [
    "Malaysian Anti-Corruption Commission Act 2009 (Act 694)",
    "MACC (Amendment) Act 2018",
    "Federal Constitution Article 132(1)(d) for service classification"
  ],
  "rule_set": [
    {
      "id": "01KS4DG6DQSGPA6431ECBMJX2L",
      "type": "formal",
      "text_or_description": "MACC investigates and refers cases to the Attorney-General's Chambers, which decides whether to charge. MACC cannot prosecute directly.",
      "legal_source": "MACC Act 2009, Sections 23-29; Federal Constitution Article 145(3)",
      "enforcement_mechanism": "Statutory referral to AGC; AGC discretion under Article 145(3)",
      "observed_compliance_rate": 1.0,
      "compliance_confidence": "HIGH",
      "active_from": "2009-01-01"
    },
    {
      "id": "01KS4DG6DQSGPA6431ECBMJX2M",
      "type": "formal",
      "text_or_description": "MACC Chief Commissioner appointed by YDPA on PM advice for renewable terms; reports to Prime Minister's Department.",
      "legal_source": "MACC Act 2009, Section 5",
      "enforcement_mechanism": "Statutory; tenure renewal at PM discretion",
      "observed_compliance_rate": 1.0,
      "compliance_confidence": "HIGH",
      "active_from": "2009-01-01"
    },
    {
      "id": "01KS4DG6DQSGPA6431ECBMJX2N",
      "type": "informal",
      "text_or_description": "Tenure-extension practice: MACC chief tenure has been extended by sitting PM rather than fixed term, reducing institutional independence in practice.",
      "legal_source": "Convention; T4A issue 1021",
      "enforcement_mechanism": "PM administrative discretion",
      "observed_compliance_rate": 1.0,
      "compliance_confidence": "MED",
      "active_from": "2009-01-01"
    },
    {
      "id": "01KS4DG6DQSGPA6431ECBMJX2P",
      "type": "formal",
      "text_or_description": "Five oversight committees (Anti-Corruption Advisory Board, Special Committee on Corruption, Complaints Committee, Operations Review Panel, Consultation and Prevention of Corruption Panel) provide layered review but have advisory powers only.",
      "legal_source": "MACC Act 2009, Sections 13-17",
      "enforcement_mechanism": "Statutory; committees report to Parliament annually",
      "observed_compliance_rate": 0.80,
      "compliance_confidence": "MED",
      "active_from": "2009-01-01"
    }
  ],
  "primary_sources": [
    {
      "tier": 1,
      "type": "statute-text",
      "title": "Malaysian Anti-Corruption Commission Act 2009 (Act 694)"
    }
  ],
  "notes": "Predecessors: Badan Pencegah Rasuah / Anti-Corruption Agency (1967-2008). The 2009 reorganisation gave statutory independence but kept the chief's tenure at PM discretion. The structural tension between investigative independence and tenure-controlled appointment is the single most consequential weakness in the anti-corruption architecture."
}
