{
  "id": "01KS4DG6DQFCYXNMQP8VSEQD6C",
  "canonical_name": "Election Commission of Malaysia (institutional)",
  "institution_category": "electoral",
  "established": "1957-09-04",
  "statutory_basis": [
    "Federal Constitution Article 113-120",
    "Elections Act 1958",
    "Election Offences Act 1954",
    "Elections (Conduct of Elections) Regulations 1981"
  ],
  "rule_set": [
    {
      "id": "01KS4DG6DQFCYXNMQP8VSEQD6D",
      "type": "formal",
      "text_or_description": "EC delimits constituencies under Article 113 with constituencies being 'approximately equal' in voter numbers, with rural-weighting exception per the Thirteenth Schedule §2(c).",
      "legal_source": "Federal Constitution Article 113, Thirteenth Schedule",
      "enforcement_mechanism": "Recommendations laid before Dewan Rakyat; passed by simple majority since 1973 amendment",
      "observed_compliance_rate": 0.60,
      "compliance_confidence": "HIGH",
      "active_from": "1957-08-31"
    },
    {
      "id": "01KS4DG6DQFCYXNMQP8VSEQD6E",
      "type": "formal",
      "text_or_description": "Original 1957 Constitution required 15% maximum deviation between constituencies. Cap removed by Constitution (Amendment) Act 1962; replaced with soft 'due consideration' language. Never restored.",
      "legal_source": "Federal Constitution Thirteenth Schedule §2 (as amended 1962, 1973)",
      "enforcement_mechanism": "Statutory; the absence of the cap is itself the rule",
      "observed_compliance_rate": 1.0,
      "compliance_confidence": "HIGH",
      "active_from": "1962-09"
    },
    {
      "id": "01KS4DG6DQFCYXNMQP8VSEQD6F",
      "type": "formal",
      "text_or_description": "EC members appointed by YDPA on PM advice. Removal procedure mirrors that for judges (Article 114(3)).",
      "legal_source": "Federal Constitution Article 114",
      "enforcement_mechanism": "Constitutional procedure",
      "observed_compliance_rate": 1.0,
      "compliance_confidence": "HIGH",
      "active_from": "1957-08-31"
    }
  ],
  "primary_sources": [
    {
      "tier": 1,
      "type": "constitution-text",
      "title": "Federal Constitution Articles 113-120 and Thirteenth Schedule"
    },
    {
      "tier": 1,
      "type": "statute-text",
      "title": "Elections Act 1958 (Act 19); Election Offences Act 1954 (Act 5)"
    }
  ],
  "notes": "Malapportionment is the structurally most consequential feature of Malaysian electoral institutions; ratio of largest to smallest parliamentary seat exceeds 9:1 in the post-2018 delineation. See malaysia-political-intelligence.md §1 for detail. The 1962 removal of the 15% cap is the single most consequential institutional drift in the post-independence EC architecture."
}
